"Status","Start Time","Stop Time","Duration in ms","Parent Suite","Suite","Sub Suite","Test Class","Test Method","Name","Description"
"passed","Wed Jul 10 21:23:32 GMT 2024","Wed Jul 10 21:23:34 GMT 2024","1726","","","","","","User cannot login with empty password",""
"failed","Wed Jul 10 21:23:53 GMT 2024","Wed Jul 10 21:24:02 GMT 2024","9200","","","","","","Place order from the main page",""
"passed","Wed Jul 10 21:23:42 GMT 2024","Wed Jul 10 21:23:44 GMT 2024","1590","Negative authorization test suite","","","","","User cannot login with incorrect password",""
"passed","Wed Jul 10 21:23:28 GMT 2024","Wed Jul 10 21:23:32 GMT 2024","4414","","","","","","Successful authorization",""
"passed","Wed Jul 10 21:23:40 GMT 2024","Wed Jul 10 21:23:42 GMT 2024","1443","Negative authorization test suite","","","","","User cannot login with empty loginname",""
"failed","Wed Jul 10 21:24:03 GMT 2024","Wed Jul 10 21:24:09 GMT 2024","6415","","","","","","Homework helper function test",""
"broken","Wed Jul 10 21:23:34 GMT 2024","Wed Jul 10 21:23:40 GMT 2024","5612","Negative authorization test suite","","","","","User cannot login with incorrect loginname",""
"passed","Wed Jul 10 21:24:18 GMT 2024","Wed Jul 10 21:24:27 GMT 2024","9060","Registration positive test suite","","","","","Registration with valid data",""
"passed","Wed Jul 10 21:23:44 GMT 2024","Wed Jul 10 21:23:45 GMT 2024","1243","Negative authorization test suite","","","","","User cannot login with empty password",""
